{
    "task_id": "TASK-0001",
    "work_item_revision": 1,
    "artifact_attempt": 1,
    "rigor": "R0",
    "created_at": "2026-08-13T14:46:06.860920Z",
    "implementer_session_id": "session-20260813-usage-manual-root",
    "required_isolation": "r0_isolated_same_session",
    "subject_base_commit": "3c86b5335d531b662e127bb5da6d8b442bf75af0",
    "subject_head_commit": "7e10dae772c07c03c29ea122d4e80a1e18d31262",
    "subject_diff_hash": "f8da6ed86a18043f59f80383eefe6a376b14103658d1f1afa1e0aa4e8b52237a",
    "previous_review": null,
    "package": [
        {
            "role": "project_rules",
            "path": "AGENTS.md",
            "kind": "file",
            "sha256": "a4464335e9c190a347f55ec762efccb667d6bae6e08fef613edd877d3d2cbb1b"
        },
        {
            "role": "work_item",
            "path": ".polaris/tasks/TASK-0001/revisions/work-item-r001.json",
            "kind": "file",
            "sha256": "7bdc57dee3dc8b168496fad8975fb669fa5353971254be4bc2886db67af59640"
        },
        {
            "role": "plan",
            "path": ".polaris/tasks/TASK-0001/PLAN.md",
            "kind": "file",
            "sha256": "269fa3d57150e5b5dd07804363a6c063df5f4fdb3cadd1681d29e86ba564f96f"
        },
        {
            "role": "working_set",
            "path": ".polaris/tasks/TASK-0001/WORKING_SET.md",
            "kind": "file",
            "sha256": "3f3a7e2b61bd88c2418b9d15c4c441fd8616d32dbbfa71582a91ff14278f4d73"
        },
        {
            "role": "implementation",
            "path": ".polaris/tasks/TASK-0001/implementations/r001/attempt-001.json",
            "kind": "file",
            "sha256": "cb01ae474d8975b470186aab27c2daf6a9bffe34ea56993443abe431ca5c7453"
        },
        {
            "role": "knowledge_delta",
            "path": ".polaris/tasks/TASK-0001/knowledge/r001/knowledge-delta-001.json",
            "kind": "file",
            "sha256": "145e731a54253a9cae086756c947659f0e861ccdea3b7e6fb00f23894e0bbf47"
        },
        {
            "role": "evidence",
            "path": ".polaris/tasks/TASK-0001/evidence/r001",
            "kind": "directory",
            "sha256": "9f47d0a05de8e0461b0a63c388b82fcc373dd83b8fc1d9b27d04b1d5fe5f1e5e"
        },
        {
            "role": "working_set_reference",
            "path": "README.md",
            "kind": "file",
            "sha256": "235bff992a77fe387601f2c157fa26ca7bc14dbd3a18fad9565da9e91765ca13"
        },
        {
            "role": "working_set_reference",
            "path": "docs/USAGE.md",
            "kind": "file",
            "sha256": "50731d861d619dde582399f5e3513384444aa5adf8bd2a5d2d8a8ce527d4334d"
        },
        {
            "role": "working_set_reference",
            "path": "scripts/build_review_handoff.py",
            "kind": "file",
            "sha256": "5e971c2c62f8d47d8c8b87d7119cabeb2950f855964bca7f6cb1161facd02386"
        },
        {
            "role": "working_set_reference",
            "path": "scripts/init_project.py",
            "kind": "file",
            "sha256": "1216f5ffb4f2653a4ede4c00e57263be9b0228a7d432be2f24e27f230968958c"
        },
        {
            "role": "working_set_reference",
            "path": "scripts/init_task.py",
            "kind": "file",
            "sha256": "7789d49ab401026f13abc1cb4b9aaede32f61c740dc9df60fcffb48b5c6abc8c"
        },
        {
            "role": "working_set_reference",
            "path": "scripts/record_exploration.py",
            "kind": "file",
            "sha256": "6614bfccd6d3f21f7219ecfd58419d892ea6fce9a0a1a73cb17500875693128f"
        },
        {
            "role": "working_set_reference",
            "path": "scripts/recover_task.py",
            "kind": "file",
            "sha256": "1f72e9f09ddd6513e5f52cd9646ea3bb09d47007a8dff5ec814159171c5333fb"
        },
        {
            "role": "working_set_reference",
            "path": "scripts/transition_task.py",
            "kind": "file",
            "sha256": "f95dcf12ba294a4cd4dfd58343c2624bc3f59a5a3d81ddbb1c7b916c77d6a7b8"
        },
        {
            "role": "working_set_reference",
            "path": "scripts/vendor_project.py",
            "kind": "file",
            "sha256": "d6ab4646b14d53633688d92d505b7f4078f588602e2793fd7bc1d0977d6da991"
        }
    ]
}
